{
  "citations": [
    {
      "title": "IAS 2 bounded manufacturing accounting"
    }
  ],
  "effective_period": "2026-01-01 to 2026-12-31",
  "entity_scope": "Synthetic Group",
  "framework": "IFRS",
  "guidance": "Controlled inventory and manufacturing costs reconcile from supplied source populations through RM, WIP, finished goods and all journal offsets.\nReview status: partial\nCalculations: {\"class_bridges\": {\"Finished goods\": {\"closing\": \"811.80\", \"opening\": \"0.00\", \"own_movement\": \"811.80\", \"retained_owner_intake\": \"0\"}, \"Raw materials\": {\"closing\": \"548.00\", \"opening\": \"1370.00\", \"own_movement\": \"-822.00\", \"retained_owner_intake\": \"0\"}, \"Work in progress\": {\"closing\": \"270.60\", \"opening\": \"0.00\", \"own_movement\": \"270.60\", \"retained_owner_intake\": \"0\"}}, \"closing_inventory\": \"1630.40\", \"cogs\": \"270.60\", \"inventory_by_class\": {\"Finished goods\": \"811.80\", \"Merchandise\": \"0\", \"Raw materials\": \"548.00\", \"Work in progress\": \"270.60\"}, \"inventory_own_movement\": \"260.40\", \"manufacturing_expense\": \"137.00\", \"opening_inventory\": \"1370.00\", \"order-1\": {\"abnormal_material_expense\": \"0.00\", \"absorbed_fixed\": \"137.00\", \"actual_eligible_total\": \"1353.00\", \"closing_equivalent_units\": \"20\", \"closing_wip\": \"270.60\", \"completed_cost\": \"1082.40\", \"completed_quantity\": \"80\", \"direct_labour\": \"274.00\", \"finished_unit_cost\": \"13.53\", \"fixed_overhead\": \"274.00\", \"material\": \"822.00\", \"standard_recovery\": \"137.00\", \"standard_total\": \"1353.00\", \"under_recovery\": \"137.00\", \"variable_overhead\": \"120\", \"variances\": {}}, \"owner_handoffs\": {\"controls_movement_count\": 3, \"disclosure_inventory\": \"1630.40\", \"financial_statements\": \"1630.40\", \"revenue_cogs\": \"270.60\", \"systems_item_count\": 3}, \"quantity_population\": {\"component\": {\"closing_quantity\": \"40\", \"inflows\": \"0\", \"opening_quantity\": \"100\", \"quantity_basis\": \"controlled_physical_units\", \"reliefs\": \"60\", \"unit\": \"units\"}, \"order-wip\": {\"closing_quantity\": \"20\", \"inflows\": \"0\", \"opening_quantity\": \"0\", \"quantity_basis\": \"controlled_equivalent_units\", \"reliefs\": \"0\", \"unit\": \"units\"}, \"product\": {\"closing_quantity\": \"60\", \"inflows\": \"80\", \"opening_quantity\": \"0\", \"quantity_basis\": \"controlled_physical_units\", \"reliefs\": \"20\", \"unit\": \"units\"}}, \"retained_owner_intake\": \"0\", \"reversal\": \"0\", \"write_down\": \"0\"}\nJournals: [[{\"side\": \"Dr\", \"account\": \"Work in progress\", \"amount\": \"822.00\"}, {\"side\": \"Cr\", \"account\": \"Raw materials\", \"amount\": \"822.00\"}], [{\"side\": \"Dr\", \"account\": \"Work in progress\", \"amount\": \"274.00\"}, {\"side\": \"Cr\", \"account\": \"Labour clearing\", \"amount\": \"274.00\"}], [{\"side\": \"Dr\", \"account\": \"Work in progress\", \"amount\": \"120.00\"}, {\"side\": \"Cr\", \"account\": \"Overhead clearing\", \"amount\": \"120.00\"}], [{\"side\": \"Dr\", \"account\": \"Work in progress\", \"amount\": \"137.00\"}, {\"side\": \"Cr\", \"account\": \"Overhead clearing\", \"amount\": \"137.00\"}], [{\"side\": \"Dr\", \"account\": \"Unallocated overhead expense\", \"amount\": \"137.00\"}, {\"side\": \"Cr\", \"account\": \"Overhead clearing\", \"amount\": \"137.00\"}], [{\"side\": \"Dr\", \"account\": \"Finished goods\", \"amount\": \"1082.40\"}, {\"side\": \"Cr\", \"account\": \"Work in progress\", \"amount\": \"1082.40\"}], [{\"side\": \"Dr\", \"account\": \"Cost of goods sold\", \"amount\": \"270.60\"}, {\"side\": \"Cr\", \"account\": \"Finished goods\", \"amount\": \"270.60\"}]]\nDisclosure review: Current framework-specific inventory policy, classes, formula, impairment and pledge requirements tie to supplied statements.",
  "jurisdiction": "NL",
  "limitations": [
    "Ordinary commercial inventory and controlled manufacturing accounting for 2026 only; supplied ownership, BOM, routing, capacity and valuation judgments remain independently reviewed.",
    "Joint/by-products, retail estimation, autonomous forecasts, specialist industry exceptions and borrowing-cost capitalization require separate governed methods. No ERP posting or audit opinion is issued.",
    "Upstream owner entries remain with their originating owner; Inventory records eligible cost absorption and inventory relief once.",
    "Controlled actual source facts and current framework-specific standards determine cost, capacity, ownership and valuation."
  ],
  "topic_id": "SUPPLEMENTAL_INVENTORY_COST",
  "uncertainties": [
    "Independent reviewer must approve this exact case fingerprint before use"
  ]
}
