{
  "citations": [
    {
      "title": "ASC 330 bounded manufacturing accounting"
    }
  ],
  "effective_period": "2026-01-01 to 2026-12-31",
  "entity_scope": "Synthetic Group",
  "framework": "US_GAAP",
  "guidance": "Controlled inventory and manufacturing costs reconcile from supplied source populations through RM, WIP, finished goods and all journal offsets.\nReview status: partial\nCalculations: {\"class_bridges\": {\"Merchandise\": {\"closing\": \"150\", \"opening\": \"100\", \"own_movement\": \"50.00\", \"retained_owner_intake\": \"0\"}}, \"closing_inventory\": \"150\", \"cogs\": \"100.00\", \"inventory_by_class\": {\"Finished goods\": \"0\", \"Merchandise\": \"150\", \"Raw materials\": \"0\", \"Work in progress\": \"0\"}, \"inventory_own_movement\": \"50.00\", \"manufacturing_expense\": \"0\", \"opening_inventory\": \"100\", \"owner_handoffs\": {\"controls_movement_count\": 2, \"disclosure_inventory\": \"150\", \"financial_statements\": \"150\", \"revenue_cogs\": \"100.00\", \"systems_item_count\": 1}, \"quantity_population\": {\"goods\": {\"closing_quantity\": \"15\", \"inflows\": \"10\", \"opening_quantity\": \"10\", \"quantity_basis\": \"controlled_physical_units\", \"reliefs\": \"5\", \"unit\": \"units\"}}, \"retained_owner_intake\": \"0\", \"reversal\": \"0\", \"write_down\": \"50.00\"}\nJournals: [[{\"side\": \"Dr\", \"account\": \"Merchandise\", \"amount\": \"200.00\"}, {\"side\": \"Cr\", \"account\": \"Acquisition clearing\", \"amount\": \"200.00\"}], [{\"side\": \"Dr\", \"account\": \"Cost of goods sold\", \"amount\": \"100.00\"}, {\"side\": \"Cr\", \"account\": \"Merchandise\", \"amount\": \"100.00\"}], [{\"side\": \"Cr\", \"account\": \"Merchandise\", \"amount\": \"50.00\"}, {\"side\": \"Dr\", \"account\": \"Inventory measurement expense\", \"amount\": \"50.00\"}]]\nDisclosure review: Current framework-specific inventory policy, classes, formula, impairment and pledge requirements tie to supplied statements.",
  "jurisdiction": "NL",
  "limitations": [
    "Ordinary commercial inventory and controlled manufacturing accounting for 2026 only; supplied ownership, BOM, routing, capacity and valuation judgments remain independently reviewed.",
    "Joint/by-products, retail estimation, autonomous forecasts, specialist industry exceptions and borrowing-cost capitalization require separate governed methods. No ERP posting or audit opinion is issued.",
    "Upstream owner entries remain with their originating owner; Inventory records eligible cost absorption and inventory relief once.",
    "Controlled actual source facts and current framework-specific standards determine cost, capacity, ownership and valuation."
  ],
  "topic_id": "SUPPLEMENTAL_INVENTORY_COST",
  "uncertainties": [
    "Independent reviewer must approve this exact case fingerprint before use"
  ]
}
