{
  "topic_id": "SUPPLEMENTAL_INSURANCE_CONTRACTS",
  "guidance": "Qualified insurance accounting schedules and gross reporting support reconciled\nReview status: partial\nCalculations: {\"actuarial_boundary\": {\"assumption_registers\": [\"assumptions1\"], \"model_versions\": [\"model1\"], \"status\": \"qualified_inputs_consumed\", \"valuation_date\": \"2026-12-31\"}, \"disclosure_support\": {\"actuarial_report_ids\": [\"report1\"], \"amounts\": [{\"acquisition\": \"120\", \"contract_ids\": [\"policy1\"], \"csm\": \"0\", \"economic_id\": \"group-economic1\", \"finance\": \"0\", \"id\": \"group1\", \"incurred_claims\": \"200\", \"loss_component\": \"0\", \"model\": \"AASB17_PAA\", \"perspective\": \"issued\", \"portfolio\": \"property\", \"premium\": \"1200\", \"remaining_coverage\": \"600.00\", \"report_id\": \"report1\", \"revenue\": \"600.00\", \"risk_adjustment\": \"0\", \"rollforwards\": {\"csm\": {\"closing\": \"0\", \"future_service_change\": \"0\", \"interest\": \"0\", \"new_business\": \"0\", \"opening\": \"0\", \"service_release\": \"0\"}, \"incurred_claims\": {\"claim_payments\": \"-100\", \"closing\": \"200\", \"finance\": \"0\", \"incurred_pv\": \"280\", \"incurred_ra\": \"20\", \"opening\": \"0\", \"past_service_change\": \"0\"}, \"loss_component\": {\"closing\": \"0\", \"new_business\": \"0\", \"opening\": \"0\", \"service_allocation\": \"0\"}, \"remaining_coverage\": {\"acquisition_amortization\": \"0\", \"acquisition_payment\": \"0\", \"closing\": \"600.00\", \"onerous_loss\": \"0\", \"opening\": \"0\", \"premiums\": \"1200\", \"service_release\": \"-600.00\"}, \"risk_adjustment\": {\"closing\": \"0\", \"new_business\": \"0\", \"opening\": \"0\", \"service_release\": \"0\"}}, \"service_expense\": \"420\"}], \"amounts_by_group\": {\"group1\": {\"acquisition\": \"120\", \"contract_ids\": [\"policy1\"], \"csm\": \"0\", \"economic_id\": \"group-economic1\", \"finance\": \"0\", \"id\": \"group1\", \"incurred_claims\": \"200\", \"loss_component\": \"0\", \"model\": \"AASB17_PAA\", \"perspective\": \"issued\", \"portfolio\": \"property\", \"premium\": \"1200\", \"remaining_coverage\": \"600.00\", \"report_id\": \"report1\", \"revenue\": \"600.00\", \"risk_adjustment\": \"0\", \"rollforwards\": {\"csm\": {\"closing\": \"0\", \"future_service_change\": \"0\", \"interest\": \"0\", \"new_business\": \"0\", \"opening\": \"0\", \"service_release\": \"0\"}, \"incurred_claims\": {\"claim_payments\": \"-100\", \"closing\": \"200\", \"finance\": \"0\", \"incurred_pv\": \"280\", \"incurred_ra\": \"20\", \"opening\": \"0\", \"past_service_change\": \"0\"}, \"loss_component\": {\"closing\": \"0\", \"new_business\": \"0\", \"opening\": \"0\", \"service_allocation\": \"0\"}, \"remaining_coverage\": {\"acquisition_amortization\": \"0\", \"acquisition_payment\": \"0\", \"closing\": \"600.00\", \"onerous_loss\": \"0\", \"opening\": \"0\", \"premiums\": \"1200\", \"service_release\": \"-600.00\"}, \"risk_adjustment\": {\"closing\": \"0\", \"new_business\": \"0\", \"opening\": \"0\", \"service_release\": \"0\"}}, \"service_expense\": \"420\"}}, \"claim_ids\": [\"claim1\"], \"group_ids\": [\"group1\"], \"policy_ids\": [\"policy1\"], \"requirements\": [\"amounts\", \"financial_risk\", \"insurance_risk\", \"judgments\", \"rollforwards\"]}, \"gl_movements\": {\"Cash\": \"980.00\", \"Insurance incurred claims group1\": \"-200.00\", \"Insurance remaining coverage group1\": \"-600.00\", \"Insurance service expense group1\": \"420.00\", \"Insurance service revenue group1\": \"-600.00\"}, \"groups\": [{\"acquisition\": \"120\", \"contract_ids\": [\"policy1\"], \"csm\": \"0\", \"economic_id\": \"group-economic1\", \"finance\": \"0\", \"id\": \"group1\", \"incurred_claims\": \"200\", \"loss_component\": \"0\", \"model\": \"AASB17_PAA\", \"perspective\": \"issued\", \"portfolio\": \"property\", \"premium\": \"1200\", \"remaining_coverage\": \"600.00\", \"report_id\": \"report1\", \"revenue\": \"600.00\", \"risk_adjustment\": \"0\", \"rollforwards\": {\"csm\": {\"closing\": \"0\", \"future_service_change\": \"0\", \"interest\": \"0\", \"new_business\": \"0\", \"opening\": \"0\", \"service_release\": \"0\"}, \"incurred_claims\": {\"claim_payments\": \"-100\", \"closing\": \"200\", \"finance\": \"0\", \"incurred_pv\": \"280\", \"incurred_ra\": \"20\", \"opening\": \"0\", \"past_service_change\": \"0\"}, \"loss_component\": {\"closing\": \"0\", \"new_business\": \"0\", \"opening\": \"0\", \"service_allocation\": \"0\"}, \"remaining_coverage\": {\"acquisition_amortization\": \"0\", \"acquisition_payment\": \"0\", \"closing\": \"600.00\", \"onerous_loss\": \"0\", \"opening\": \"0\", \"premiums\": \"1200\", \"service_release\": \"-600.00\"}, \"risk_adjustment\": {\"closing\": \"0\", \"new_business\": \"0\", \"opening\": \"0\", \"service_release\": \"0\"}}, \"service_expense\": \"420\"}], \"statement_support\": [{\"account\": \"Cash\", \"category\": \"asset\", \"currency\": \"EUR\", \"economic_id\": \"insurance_cash\", \"group_id\": null, \"id\": \"Cash\", \"signed_balance\": \"980\"}, {\"account\": \"Insurance remaining coverage group1\", \"category\": \"liability\", \"currency\": \"EUR\", \"economic_id\": \"group-economic1\", \"group_id\": \"group1\", \"id\": \"Insurance remaining coverage group1\", \"signed_balance\": \"-600\"}, {\"account\": \"Insurance incurred claims group1\", \"category\": \"liability\", \"currency\": \"EUR\", \"economic_id\": \"group-economic1\", \"group_id\": \"group1\", \"id\": \"Insurance incurred claims group1\", \"signed_balance\": \"-200\"}, {\"account\": \"Insurance service revenue group1\", \"category\": \"revenue\", \"currency\": \"EUR\", \"economic_id\": \"group-economic1\", \"group_id\": \"group1\", \"id\": \"Insurance service revenue group1\", \"signed_balance\": \"-600\"}, {\"account\": \"Insurance service expense group1\", \"category\": \"expense\", \"currency\": \"EUR\", \"economic_id\": \"group-economic1\", \"group_id\": \"group1\", \"id\": \"Insurance service expense group1\", \"signed_balance\": \"420\"}]}\nJournals: [[{\"side\": \"Dr\", \"account\": \"Cash\", \"amount\": \"1200.00\"}, {\"side\": \"Cr\", \"account\": \"Insurance remaining coverage group1\", \"amount\": \"1200.00\"}], [{\"side\": \"Dr\", \"account\": \"Insurance service expense group1\", \"amount\": \"120.00\"}, {\"side\": \"Cr\", \"account\": \"Cash\", \"amount\": \"120.00\"}], [{\"side\": \"Dr\", \"account\": \"Insurance remaining coverage group1\", \"amount\": \"600.00\"}, {\"side\": \"Cr\", \"account\": \"Insurance service revenue group1\", \"amount\": \"600.00\"}], [{\"side\": \"Dr\", \"account\": \"Insurance service expense group1\", \"amount\": \"300.00\"}, {\"side\": \"Cr\", \"account\": \"Insurance incurred claims group1\", \"amount\": \"300.00\"}], [{\"side\": \"Dr\", \"account\": \"Insurance incurred claims group1\", \"amount\": \"100.00\"}, {\"side\": \"Cr\", \"account\": \"Cash\", \"amount\": \"100.00\"}]]\nDisclosure review: Insurance amounts and rollforwards; Qualified methods, assumptions and insurance/financial risk; Issued and held populations remain separate; Disclosure Management owns final requirements",
  "framework": "AASB",
  "jurisdiction": "NL",
  "entity_scope": "Synthetic Group",
  "effective_period": "2026-01-01 to 2026-12-31",
  "limitations": [
    "First-year single-currency issued GMM/PAA and native US short-duration routes only; advanced models and specialist owner accounting require separate governed methods.",
    "Current qualified inputs and the operative insurance framework are required; complex models require separate governed methods."
  ],
  "uncertainties": [
    "Independent reviewer must approve this exact case fingerprint before use"
  ],
  "citations": [
    {
      "title": "AASB 17 Tier 1 for-profit insurance accounting"
    }
  ]
}
