{
  "topic_id": "TOPIC-06-008",
  "guidance": "Qualified derivative scope, valuation bridges, framework hedge journals and reserves reconcile\nReview status: complete\nCalculations: {\"basis_adjustments\": [], \"derivatives\": [{\"change\": \"100\", \"closing\": \"100\", \"earnings_release\": \"0\", \"effective\": \"0\", \"hedged_item_change\": \"0\", \"id\": \"forward1\", \"ineffectiveness\": \"100\", \"opening\": \"0\", \"route\": \"standalone\", \"settlement\": \"0\"}], \"effectiveness\": [{\"id\": \"relationship1\", \"reason\": \"Documentation or designation timing failed; standalone derivative earnings accounting\", \"status\": \"failed_designation\"}], \"gl_movements\": {\"Derivative P&L forward1\": \"-100.00\", \"Derivative balance forward1\": \"100.00\"}, \"hedge_reserves\": []}\nJournals: [[{\"side\": \"Dr\", \"account\": \"Derivative balance forward1\", \"amount\": \"100.00\"}, {\"side\": \"Cr\", \"account\": \"Derivative P&L forward1\", \"amount\": \"100.00\"}]]\nDisclosure review: Framework-specific instrument, risk, reserve and accounting-effect disclosure support",
  "framework": "AASB",
  "jurisdiction": "NL",
  "entity_scope": "Synthetic Group",
  "effective_period": "2026-01-01 to 2026-12-31",
  "limitations": [
    "2026 operative basic full-instrument routes only. Advanced techniques and midperiod measurement splits require a governed specialist method.",
    "Qualified current evidence and the operative accounting model are required; source confidence remains bounded."
  ],
  "uncertainties": [],
  "citations": [
    {
      "title": "AASB 9 / AASB 7 derivative and hedge accounting"
    }
  ]
}
