{
  "topic_id": "TOPIC-08-005",
  "guidance": "Framework horizon, forecasts, maturities and supported management plans assessed.\nReview status: partial\nCalculations: {\"available_cash\": \"1000\", \"disclosure_tier\": \"ordinary_review\", \"horizon_end\": \"2027-12-31\", \"scenarios\": [{\"first_reserve_shortfall_period_before_plans\": null, \"forecast\": [{\"after_plans\": \"1000.00\", \"before_plans\": \"1000.00\", \"date\": \"2027-01-31\", \"headroom\": \"1000.00\", \"plan_funding\": \"0.00\"}, {\"after_plans\": \"1000.00\", \"before_plans\": \"1000.00\", \"date\": \"2027-02-28\", \"headroom\": \"1000.00\", \"plan_funding\": \"0.00\"}, {\"after_plans\": \"1000.00\", \"before_plans\": \"1000.00\", \"date\": \"2027-03-31\", \"headroom\": \"1000.00\", \"plan_funding\": \"0.00\"}, {\"after_plans\": \"1000.00\", \"before_plans\": \"1000.00\", \"date\": \"2027-04-30\", \"headroom\": \"1000.00\", \"plan_funding\": \"0.00\"}, {\"after_plans\": \"1000.00\", \"before_plans\": \"1000.00\", \"date\": \"2027-05-31\", \"headroom\": \"1000.00\", \"plan_funding\": \"0.00\"}, {\"after_plans\": \"1000.00\", \"before_plans\": \"1000.00\", \"date\": \"2027-06-30\", \"headroom\": \"1000.00\", \"plan_funding\": \"0.00\"}, {\"after_plans\": \"1000.00\", \"before_plans\": \"1000.00\", \"date\": \"2027-07-31\", \"headroom\": \"1000.00\", \"plan_funding\": \"0.00\"}, {\"after_plans\": \"1000.00\", \"before_plans\": \"1000.00\", \"date\": \"2027-08-31\", \"headroom\": \"1000.00\", \"plan_funding\": \"0.00\"}, {\"after_plans\": \"1000.00\", \"before_plans\": \"1000.00\", \"date\": \"2027-09-30\", \"headroom\": \"1000.00\", \"plan_funding\": \"0.00\"}, {\"after_plans\": \"1000.00\", \"before_plans\": \"1000.00\", \"date\": \"2027-10-31\", \"headroom\": \"1000.00\", \"plan_funding\": \"0.00\"}, {\"after_plans\": \"1000.00\", \"before_plans\": \"1000.00\", \"date\": \"2027-11-30\", \"headroom\": \"1000.00\", \"plan_funding\": \"0.00\"}, {\"after_plans\": \"1000.00\", \"before_plans\": \"1000.00\", \"date\": \"2027-12-31\", \"headroom\": \"1000.00\", \"plan_funding\": \"0.00\"}], \"id\": \"base\", \"kind\": \"base\", \"minimum_after\": \"1000.00\", \"minimum_before\": \"1000.00\"}, {\"first_reserve_shortfall_period_before_plans\": null, \"forecast\": [{\"after_plans\": \"980.00\", \"before_plans\": \"980.00\", \"date\": \"2027-01-31\", \"headroom\": \"980.00\", \"plan_funding\": \"0.00\"}, {\"after_plans\": \"960.00\", \"before_plans\": \"960.00\", \"date\": \"2027-02-28\", \"headroom\": \"960.00\", \"plan_funding\": \"0.00\"}, {\"after_plans\": \"940.00\", \"before_plans\": \"940.00\", \"date\": \"2027-03-31\", \"headroom\": \"940.00\", \"plan_funding\": \"0.00\"}, {\"after_plans\": \"920.00\", \"before_plans\": \"920.00\", \"date\": \"2027-04-30\", \"headroom\": \"920.00\", \"plan_funding\": \"0.00\"}, {\"after_plans\": \"900.00\", \"before_plans\": \"900.00\", \"date\": \"2027-05-31\", \"headroom\": \"900.00\", \"plan_funding\": \"0.00\"}, {\"after_plans\": \"880.00\", \"before_plans\": \"880.00\", \"date\": \"2027-06-30\", \"headroom\": \"880.00\", \"plan_funding\": \"0.00\"}, {\"after_plans\": \"860.00\", \"before_plans\": \"860.00\", \"date\": \"2027-07-31\", \"headroom\": \"860.00\", \"plan_funding\": \"0.00\"}, {\"after_plans\": \"840.00\", \"before_plans\": \"840.00\", \"date\": \"2027-08-31\", \"headroom\": \"840.00\", \"plan_funding\": \"0.00\"}, {\"after_plans\": \"820.00\", \"before_plans\": \"820.00\", \"date\": \"2027-09-30\", \"headroom\": \"820.00\", \"plan_funding\": \"0.00\"}, {\"after_plans\": \"800.00\", \"before_plans\": \"800.00\", \"date\": \"2027-10-31\", \"headroom\": \"800.00\", \"plan_funding\": \"0.00\"}, {\"after_plans\": \"780.00\", \"before_plans\": \"780.00\", \"date\": \"2027-11-30\", \"headroom\": \"780.00\", \"plan_funding\": \"0.00\"}, {\"after_plans\": \"760.00\", \"before_plans\": \"760.00\", \"date\": \"2027-12-31\", \"headroom\": \"760.00\", \"plan_funding\": \"0.00\"}], \"id\": \"downside\", \"kind\": \"downside\", \"minimum_after\": \"760.00\", \"minimum_before\": \"760.00\"}], \"sensitivity_reductions\": [\"25.00\"]}\nJournals: []\nDisclosure review: Basis, significant judgment/material uncertainty or ASC205-40 substantial doubt, plans and dependencies, debt covenants and subsequent events.",
  "framework": "IFRS",
  "jurisdiction": "NL",
  "entity_scope": "Synthetic Group",
  "effective_period": "2026-01-01 to 2026-12-31",
  "limitations": [
    "Company recognition, valuation, legal rights and tax conclusions require supplied evidence and independent review. No universal ERP posting authorization is inferred.",
    "Precise authority is not asserted where the governed register has no verified paragraph; apply actual effective edition and entity scope."
  ],
  "uncertainties": [
    "Independent reviewer must approve this exact case fingerprint before use"
  ],
  "citations": [
    {
      "title": "Applicable IAS 1 / IAS 8 / IAS 10"
    },
    {
      "title": "Applicable IAS 1 / IAS 8 / IAS 10",
      "locator": "Unverified paragraph reference: IAS 10.8–10, 14–16"
    },
    {
      "title": "Applicable IAS 1 / IAS 8 / IAS 10",
      "locator": "3; 8–14"
    },
    {
      "title": "Applicable IAS 1 / IAS 8 / IAS 10",
      "locator": "Unverified paragraph reference: IFRS 9.3.3.2–3.3.3, B3.3.6"
    }
  ]
}
