{
  "citations": [
    {
      "title": "IAS 10"
    },
    {
      "locator": "Unverified paragraph reference: IAS 10.8\u201310, 14\u201316",
      "title": "IAS 10"
    },
    {
      "locator": "3; 8\u201314",
      "title": "IAS 10"
    }
  ],
  "effective_period": "2026-01-01 to 2026-12-31",
  "entity_scope": "Synthetic Group",
  "framework": "IFRS",
  "guidance": "Subsequent-event window, recognition owners and disclosures reconciled\nReview status: complete\nCalculations: {\"cutoff\": \"2027-03-31\", \"events\": [{\"adjusting\": false, \"disclosed\": true, \"financial_effect\": \"100\", \"kind\": \"financing\"}], \"statement_adjustments\": {}}\nJournals: []\nDisclosure review: Reviewed operative-framework disclosure checklist; source and GL amounts tie to statement/note population; Policies, movements, significant judgments and unrecognized or specialist-dependent exposures",
  "jurisdiction": "NL",
  "limitations": [
    "Company recognition, valuation, legal rights and tax conclusions require supplied evidence and independent review. No universal ERP posting authorization is inferred.",
    "Precise authority is not asserted where the governed register has no verified paragraph; apply actual effective edition and entity scope."
  ],
  "topic_id": "TOPIC-08-005",
  "uncertainties": []
}
