{
  "citations": [],
  "effective_period": "2026-01-01 to 2026-12-31",
  "entity_scope": "Synthetic Group",
  "framework": "UK_GAAP",
  "guidance": "Accounting-function readiness evidence workpaper reviewed\nReview status: partial\nCalculations: {\"area_count\": 9, \"ipo_readiness_score_produced\": false, \"supported_area_count\": 9, \"unresolved_gap_count\": 0}\nJournals: []\nDisclosure review: Reviewed operative-framework disclosure checklist; source and GL amounts tie to statement/note population; Policies, movements, significant judgments and unrecognized or specialist-dependent exposures",
  "jurisdiction": "NL",
  "limitations": [
    "Qualified accounting-function assessment only. No IPO success/timetable, SEC compliance, generic staffing target, audit opinion or filing conclusion. Actual market/jurisdiction obligations remain separately verified.",
    "Management governance workpaper only; underlying accounting and current actual jurisdictional requirements remain separately qualified."
  ],
  "topic_id": "TOPIC-01-008",
  "uncertainties": [
    "Independent reviewer must approve this exact case fingerprint before use"
  ]
}
