{
  "topic_id": "TOPIC-05-003",
  "guidance": "Complete contracts/claims and distinct recognized/disclosed amounts reconcile.\nReview status: complete\nCalculations: {\"maximum_contractual_exposure\": \"120\", \"recognized_balances\": \"0\", \"register\": [{\"contractual_exposure\": \"120\", \"disclosed\": true, \"id\": \"purchase\", \"kind\": \"purchase\", \"recognized\": \"0\", \"route\": \"ordinary_commitment\"}]}\nJournals: []\nDisclosure review: Nature/terms, maturity/maximum exposure, recognized provisions, uncertainties/reimbursements, guarantee/security, gain contingencies and framework-specific exemptions.",
  "framework": "US_GAAP",
  "jurisdiction": "NL",
  "entity_scope": "Synthetic Group",
  "effective_period": "2026-01-01 to 2026-12-31",
  "limitations": [
    "Company recognition, valuation, legal rights and tax conclusions require supplied evidence and independent review. No universal ERP posting authorization is inferred.",
    "Precise authority is not asserted where the governed register has no verified paragraph; apply actual effective edition and entity scope."
  ],
  "uncertainties": [],
  "citations": [
    {
      "title": "ASC 450 / contract-specific guidance"
    }
  ]
}
