{
  "topic_id": "TOPIC-05-005",
  "guidance": "Qualified defined-benefit/OPEB accounting workpaper; no actuarial valuation\nReview status: complete\nCalculations: {\"closing_deficit\": \"210\", \"contributions\": \"70\", \"oci_loss\": \"12\", \"opening_deficit\": \"200\", \"pnl_expense\": \"68\", \"service_cost\": \"60\"}\nJournals: [[{\"side\": \"Dr\", \"account\": \"Pension expense\", \"amount\": \"68.00\"}, {\"side\": \"Cr\", \"account\": \"DB net liability\", \"amount\": \"68.00\"}], [{\"side\": \"Dr\", \"account\": \"Pension OCI\", \"amount\": \"12.00\"}, {\"side\": \"Cr\", \"account\": \"DB net liability\", \"amount\": \"12.00\"}], [{\"side\": \"Cr\", \"account\": \"Cash\", \"amount\": \"70.00\"}, {\"side\": \"Dr\", \"account\": \"DB net liability\", \"amount\": \"70.00\"}]]\nDisclosure review: Reviewed operative-framework disclosure checklist; source and GL amounts tie to statement/note population; Policies, movements, significant judgments and unrecognized or specialist-dependent exposures",
  "framework": "IFRS",
  "jurisdiction": "NL",
  "entity_scope": "Synthetic Group",
  "effective_period": "2026-01-01 to 2026-12-31",
  "limitations": [
    "Qualified actuarial and plan-source accounting workpaper, not an actuarial valuation or opinion.",
    "Only the event-free IFRS deficit pension bridge creates journals. US, FRS 102 and AASB detailed accounting presentation require separately governed methods.",
    "Surplus/asset ceiling, minimum funding, multi-employer, amendments, settlements, curtailments, foreign currency and other-long-term routes are excluded.",
    "Qualified actual sources and current framework/period review required. No actuarial, legal, audit or external compliance certification."
  ],
  "uncertainties": [],
  "citations": [
    {
      "title": "IAS 19 bounded actuarial accounting bridge"
    },
    {
      "title": "IAS 19 bounded actuarial accounting bridge",
      "locator": "Unverified paragraph reference: IAS 19.11\u201324, 57\u201367, 120\u2013123"
    }
  ]
}
