{
  "topic_id": "SUPPLEMENTAL_AGRICULTURE",
  "guidance": "Biological asset FV less costs to sell, quantity/GL bridge and harvest boundary reconciled\nReview status: complete\nCalculations: {\"assets\": [{\"closing\": \"481.0\", \"opening\": \"370.0\", \"quantity\": \"2\", \"terminal\": \"living\"}, {\"closing\": \"0\", \"opening\": \"185.0\", \"quantity\": \"2\", \"terminal\": \"harvest\"}, {\"closing\": \"296.0\", \"opening\": \"0.0\", \"quantity\": \"2\", \"terminal\": \"living\"}], \"biological_measurement_gain\": \"259.0\", \"closing\": \"777.0\", \"currency\": \"USD\", \"harvest\": [{\"biological_carrying_removed\": \"259.0\", \"downstream_owner\": \"Inventory & Cost Accounting unavailable; no subsequent measurement performed\", \"entry_value\": \"240.5\", \"harvest_conversion_gain\": \"-18.5\", \"quantity\": \"83\", \"unit\": \"kg\"}], \"harvest_biological_carrying_removed\": \"259.0\", \"harvest_conversion_gain\": \"-18.5\", \"harvest_entry\": \"240.5\", \"measurement_gain\": \"240.5\", \"mortality_loss\": \"0\", \"opening\": \"555.0\", \"purchases\": \"222.0\", \"quantity_bridge\": {\"births\": \"0\", \"closing\": \"4\", \"deaths\": \"0\", \"harvest\": \"2\", \"opening\": \"4\", \"purchases\": \"2\"}, \"quantity_unit\": \"biological_units\"}\nJournals: [[{\"side\": \"Dr\", \"account\": \"Biological assets\", \"amount\": \"111.00\"}, {\"side\": \"Cr\", \"account\": \"Agriculture measurement gain\", \"amount\": \"111.00\"}], [{\"side\": \"Dr\", \"account\": \"Biological assets\", \"amount\": \"74.00\"}, {\"side\": \"Cr\", \"account\": \"Agriculture measurement gain\", \"amount\": \"74.00\"}], [{\"side\": \"Dr\", \"account\": \"Harvest inventory entry\", \"amount\": \"240.50\"}, {\"side\": \"Cr\", \"account\": \"Biological assets\", \"amount\": \"259.00\"}, {\"side\": \"Dr\", \"account\": \"Agriculture measurement gain\", \"amount\": \"18.50\"}], [{\"side\": \"Dr\", \"account\": \"Biological assets\", \"amount\": \"222.00\"}, {\"side\": \"Cr\", \"account\": \"Cash\", \"amount\": \"222.00\"}], [{\"side\": \"Dr\", \"account\": \"Biological assets\", \"amount\": \"37.00\"}, {\"side\": \"Cr\", \"account\": \"Agriculture measurement gain\", \"amount\": \"37.00\"}], [{\"side\": \"Dr\", \"account\": \"Biological assets\", \"amount\": \"37.00\"}, {\"side\": \"Cr\", \"account\": \"Agriculture measurement gain\", \"amount\": \"37.00\"}]]\nDisclosure review: Class and policy-specific disclosure support reconciled; use Financial Statements and Disclosure Management owners for final reporting",
  "framework": "AASB",
  "jurisdiction": "NL",
  "entity_scope": "Synthetic Group",
  "effective_period": "2026-01-01 to 2026-12-31",
  "limitations": [
    "Qualified current valuation and control evidence are required; this workpaper does not value a farm or establish legal rights.",
    "Harvest transfers establish the entry amount only. Post-harvest Inventory & Cost Accounting is unavailable.",
    "Government assistance, foreign currency, cost-model exceptions and sales recognition require separate accounting owners.",
    "Qualified current Agriculture valuation and operative-period evidence required. Post-harvest inventory and grants require separate owners."
  ],
  "uncertainties": [],
  "citations": [
    {
      "title": "AASB 141 Tier 1 agricultural accounting"
    }
  ]
}
