{
  "topic_id": "TOPIC-08-004",
  "guidance": "Current disclosure-management and comparative tie-out workpaper reconciled\nReview status: complete\nCalculations: {\"applicable_count\": 1, \"disclosure_compliance_certified\": false, \"note_count\": 1, \"requirement_count\": 1}\nJournals: []\nDisclosure review: Reviewed operative-framework disclosure checklist; source and GL amounts tie to statement/note population; Policies, movements, significant judgments and unrecognized or specialist-dependent exposures",
  "framework": "AASB",
  "jurisdiction": "NL",
  "entity_scope": "Synthetic Group",
  "effective_period": "2026-01-01 to 2026-12-31",
  "limitations": [
    "Supplied qualified current requirement inventory and owner conclusions are inputs, not a universal disclosure rulebook. Unchanged comparatives only; reclassifications/restatements require accounting-owner analysis. No filing or compliance certification.",
    "Management governance workpaper only; underlying accounting and current actual jurisdictional requirements remain separately qualified."
  ],
  "uncertainties": [],
  "citations": []
}
