{
  "topic_id": "TOPIC-05-003",
  "guidance": "Provision decision recognize; closing liability 45.00; estimate movement 15.00; separate reimbursement asset 0.00.\nReview status: complete\nCalculations: {\"provision\": \"45.00\", \"provision_bridge\": {\"closing\": \"45.00\", \"estimate_change\": \"15.00\", \"fx\": \"0\", \"opening\": \"50\", \"other\": \"0\", \"settlements\": \"20\", \"unwind\": \"0\"}, \"reimbursement\": \"0.00\", \"undiscounted_estimate\": \"45.00\"}\nJournals: [[{\"side\": \"Dr\", \"account\": \"provision expense\", \"amount\": \"15.00\"}, {\"side\": \"Cr\", \"account\": \"provision\", \"amount\": \"15.00\"}], [{\"side\": \"Dr\", \"account\": \"provision\", \"amount\": \"20.00\"}, {\"side\": \"Cr\", \"account\": \"cash\", \"amount\": \"20.00\"}], []]\nDisclosure review: Provision opening-to-closing movements by class; Nature, timing and uncertainty of obligations; Assumptions, expected reimbursements and recognized reimbursement assets; Contingent liability description and financial effect or why not practicable; ASC450 additional reasonably possible exposure beyond accrued amount; Apply framework-specific prejudicial-information exception with reviewer support",
  "framework": "UK_GAAP",
  "jurisdiction": "NL",
  "entity_scope": "Synthetic Group",
  "effective_period": "2026-01-01 to 2026-12-31",
  "limitations": [
    "Probability and legal outcome are supported judgments, not statistical thresholds inferred by the calculator. Reimbursements are separate assets; no balance-sheet netting is implied.",
    "Use the edition effective for the stated reporting period; precise paragraph authority is not asserted where the governed register has no established reference."
  ],
  "uncertainties": [],
  "citations": [
    {
      "title": "FRS 102 Section 21"
    }
  ]
}
