{
  "calculations": [
    {
      "amount": "800.00",
      "label": "ENTITY-NL IFRS EUR period revenue"
    },
    {
      "amount": "800.00",
      "label": "ENTITY-US US GAAP USD period revenue"
    },
    {
      "amount": "800.00",
      "label": "ENTITY-UK UK GAAP GBP period revenue"
    }
  ],
  "confidence": "medium",
  "controls": [
    "Independent route, estimate and journal review",
    "Source population to GL tie-out",
    "Versioned accounting policy and disclosure review"
  ],
  "effective_period": "2026-01-01 to 2026-12-31",
  "entity_scope": "GROUP-EUR, ENTITY-NL, ENTITY-UK, ENTITY-US",
  "framework": "IFRS",
  "guidance": "Revenue reviewed separately: ENTITY-NL 800.00 EUR (IFRS); ENTITY-UK 800.00 GBP (UK_GAAP); ENTITY-US 800.00 USD (US_GAAP). No consolidated IFRS/EUR total is established; local results retain their original accounting basis.",
  "journals": [],
  "jurisdiction": "NL",
  "limitations": [
    "Contract clearing journals require mapping to the contract-specific asset/liability accounts; do not offset different contracts.",
    "ENTITY-UK: framework conversion unresolved, currency translation unresolved.",
    "ENTITY-US: framework conversion unresolved, currency translation unresolved.",
    "Use the edition effective for the stated reporting period; precise paragraph authority is not asserted where the governed register has no established reference."
  ],
  "open_items": [],
  "reporting": [
    "Apply US nonpublic, UK small entity and AASB tier relief only when eligible",
    "Contract cost balances, amortization and impairment",
    "Disaggregate revenue by meaningful categories",
    "Framework-specific statement presentation and comparative-period consistency",
    "Performance obligations, payment terms and remaining obligations",
    "Reconcile receivables and contract assets/liabilities",
    "Timing, progress, price constraint and SSP judgments"
  ],
  "required_approvals": [
    "Accounting judgment memo",
    "Calculation and reconciliation",
    "Disclosure tie-out",
    "Input evidence",
    "Reviewer certification"
  ],
  "status": "complete",
  "uncertainties": [
    "Synthetic amounts and assumptions for regression only",
    "Synthetic amounts and assumptions for regression only",
    "Synthetic amounts and assumptions for regression only"
  ]
}
