{
  "citations": [],
  "effective_period": "2026-01-01 to 2026-12-31",
  "entity_scope": "Synthetic Group",
  "framework": "UK_GAAP",
  "guidance": "Accounting case cannot be completed: Missing required facts: knowledge_review\nReview status: blocked\nCalculations: {}\nJournals: []\nDisclosure review: Assess pending matter and uncertainty before reporting\nSpecialist handoff: Inventory and manufacturing accounting owner; required evidence: Current independently controlled inventory ownership, BOM/routing, material/labour/overhead sources, normal capacity, standard variance disposition, count/cutoff, lower-cost evidence and GL/disclosure bridges; Reviewed framework-specific memo, reconciled schedules/journals and disclosure impacts; rerun case with new fingerprint",
  "jurisdiction": "NL",
  "limitations": [
    "Missing required facts: knowledge_review"
  ],
  "topic_id": "SUPPLEMENTAL_INVENTORY_COST",
  "uncertainties": [
    "Missing required facts: knowledge_review"
  ]
}
