{
  "topic_id": "TOPIC-08-002",
  "guidance": "Cash population, direct and indirect statements and balance-sheet cash reconcile.\nReview status: complete\nCalculations: {\"balance_sheet_cash\": \"290\", \"closing\": \"290\", \"direct_operating\": \"240\", \"direct_support\": {\"capital_purchase\": \"-90\", \"customer_receipts\": \"400\", \"debt_proceeds\": \"50\", \"suppliers_employees\": \"-160\"}, \"financing\": \"50\", \"fx\": \"-10\", \"indirect_operating\": \"240.00\", \"investing\": \"-90\", \"noncash\": [{\"amount\": \"20\", \"id\": \"lease\", \"type\": \"new lease\"}], \"opening\": \"100\"}\nJournals: []\nDisclosure review: Cash definition/restrictions, FX bridge, financing liability changes, noncash activity, supplier finance and adopted interest/dividend policy.",
  "framework": "US_GAAP",
  "jurisdiction": "NL",
  "entity_scope": "Synthetic Group",
  "effective_period": "2026-01-01 to 2026-12-31",
  "limitations": [
    "Company recognition, valuation, legal rights and tax conclusions require supplied evidence and independent review. No universal ERP posting authorization is inferred.",
    "Precise authority is not asserted where the governed register has no verified paragraph; apply actual effective edition and entity scope."
  ],
  "uncertainties": [],
  "citations": [
    {
      "title": "ASC 230"
    }
  ]
}
