{
  "topic_id": "TOPIC-13-004",
  "guidance": "Accounting case cannot be completed: US/UK held-for-sale measurement/presentation requires a separate governed method\nReview status: blocked\nCalculations: {}\nJournals: []\nDisclosure review: Assess pending matter and uncertainty before reporting\nSpecialist handoff: Disposal, impairment, fixed assets and group specialists; required evidence: Dated disposal perimeter and classification evidence; group allocation, reversal, disposal and US/UK measurement need separate governed methods; Reviewed framework-specific memo, reconciled schedules/journals and disclosure impacts; rerun case with new fingerprint",
  "framework": "US_GAAP",
  "jurisdiction": "US",
  "entity_scope": "Synthetic Group",
  "effective_period": "2026-01-01 to 2026-12-31",
  "limitations": [
    "US/UK held-for-sale measurement/presentation requires a separate governed method"
  ],
  "uncertainties": [
    "US/UK held-for-sale measurement/presentation requires a separate governed method"
  ],
  "citations": []
}
