{
  "topic_id": "TOPIC-16-001",
  "guidance": "US registrant filing-accounting support workpaper reconciled\nReview status: complete\nCalculations: {\"query_workpaper_count\": 0, \"regulator_validation_certified\": false, \"resolved_issue_count\": 0, \"statement_line_count\": 2, \"statutory_deadline_calculated\": false, \"tag_count\": 2}\nJournals: []\nDisclosure review: Reviewed operative-framework disclosure checklist; source and GL amounts tie to statement/note population; Policies, movements, significant judgments and unrecognized or specialist-dependent exposures",
  "framework": "US_GAAP",
  "jurisdiction": "US",
  "entity_scope": "Synthetic Group",
  "effective_period": "2026-01-01 to 2026-12-31",
  "limitations": [
    "Accounting support only: no securities-law advice, EDGAR filing, officer certification, audit opinion, regulatory compliance or regulator-valid XBRL assertion. Verified calendar dates are supplied rule evidence, not computed obligations.",
    "Exact accounting and jurisdictional scope is bounded; current actual-case authority remains separately reviewed."
  ],
  "uncertainties": [],
  "citations": [
    {
      "title": "Case-specific SEC filing accounting controls"
    }
  ]
}
