{
  "citations": [
    {
      "title": "AASB 140 Tier 1 owned property"
    }
  ],
  "effective_period": "2026-01-01 to 2026-12-31",
  "entity_scope": "Synthetic Group",
  "framework": "AASB",
  "guidance": "Owned property accounting reconciled within its qualified framework and measurement model\nReview status: complete\nCalculations: {\"additions\": \"0\", \"closing_carrying\": \"650000\", \"depreciation_owned_elsewhere\": \"0\", \"disposal_carrying\": \"0\", \"disposal_gain\": \"0\", \"fair_value_movement\": \"50000\", \"impairment_owned_elsewhere\": \"0\", \"measurement_model\": \"fair_value\", \"net_proceeds\": \"0\", \"opening_carrying\": \"600000\", \"transfers\": \"0\"}\nJournals: [[{\"side\": \"Dr\", \"account\": \"Investment property\", \"amount\": \"50000.00\"}, {\"side\": \"Cr\", \"account\": \"Property fair value profit or loss\", \"amount\": \"50000.00\"}]]\nDisclosure review: Reviewed operative-framework disclosure checklist; source and GL amounts tie to statement/note population; Policies, movements, significant judgments and unrecognized or specialist-dependent exposures",
  "jurisdiction": "AU",
  "limitations": [
    "Company recognition, valuation, legal rights and tax conclusions require supplied evidence and independent review. No universal ERP posting authorization is inferred.",
    "Use the edition effective for the stated reporting period; precise paragraph authority is not asserted where the governed register has no established reference."
  ],
  "topic_id": "SUPPLEMENTAL_INVESTMENT_PROPERTY",
  "uncertainties": []
}
