{
  "citations": [
    {
      "title": "IFRS 17 insurance accounting"
    }
  ],
  "effective_period": "2026-01-01 to 2026-12-31",
  "entity_scope": "Synthetic Group",
  "framework": "IFRS",
  "guidance": "Qualified insurance accounting schedules and gross reporting support reconciled\nReview status: complete\nCalculations: {\"actuarial_boundary\": {\"assumption_registers\": [\"assumptions1\"], \"model_versions\": [\"model1\"], \"status\": \"qualified_inputs_consumed\", \"valuation_date\": \"2026-12-31\"}, \"disclosure_support\": {\"actuarial_report_ids\": [\"report1\"], \"amounts\": [{\"acquisition\": \"0\", \"contract_ids\": [\"policy1\"], \"csm\": \"117.00\", \"economic_id\": \"group-economic1\", \"finance\": \"14.00\", \"id\": \"group1\", \"incurred_claims\": \"220\", \"loss_component\": \"0\", \"model\": \"IFRS17_GMM\", \"perspective\": \"issued\", \"portfolio\": \"property\", \"premium\": \"1000\", \"remaining_coverage\": \"555.00\", \"report_id\": \"report1\", \"revenue\": \"459.00\", \"risk_adjustment\": \"30\", \"rollforwards\": {\"csm\": {\"closing\": \"117.00\", \"future_service_change\": \"0\", \"interest\": \"6.00\", \"new_business\": \"150\", \"opening\": \"0\", \"service_release\": \"-39.00\"}, \"incurred_claims\": {\"claim_payments\": \"-200\", \"closing\": \"220\", \"finance\": \"0\", \"incurred_pv\": \"400\", \"incurred_ra\": \"20\", \"opening\": \"0\", \"past_service_change\": \"0\"}, \"loss_component\": {\"closing\": \"0\", \"new_business\": \"0\", \"opening\": \"0\", \"service_allocation\": \"0\"}, \"remaining_coverage\": {\"closing\": \"555.00\", \"finance\": \"14.00\", \"loss_allocation\": \"0\", \"new_business_loss\": \"0\", \"opening\": \"0\", \"premiums\": \"1000\", \"service_release\": \"-459.00\"}, \"risk_adjustment\": {\"closing\": \"30\", \"new_business\": \"50\", \"opening\": \"0\", \"service_release\": \"-20\"}}, \"service_expense\": \"420\"}], \"amounts_by_group\": {\"group1\": {\"acquisition\": \"0\", \"contract_ids\": [\"policy1\"], \"csm\": \"117.00\", \"economic_id\": \"group-economic1\", \"finance\": \"14.00\", \"id\": \"group1\", \"incurred_claims\": \"220\", \"loss_component\": \"0\", \"model\": \"IFRS17_GMM\", \"perspective\": \"issued\", \"portfolio\": \"property\", \"premium\": \"1000\", \"remaining_coverage\": \"555.00\", \"report_id\": \"report1\", \"revenue\": \"459.00\", \"risk_adjustment\": \"30\", \"rollforwards\": {\"csm\": {\"closing\": \"117.00\", \"future_service_change\": \"0\", \"interest\": \"6.00\", \"new_business\": \"150\", \"opening\": \"0\", \"service_release\": \"-39.00\"}, \"incurred_claims\": {\"claim_payments\": \"-200\", \"closing\": \"220\", \"finance\": \"0\", \"incurred_pv\": \"400\", \"incurred_ra\": \"20\", \"opening\": \"0\", \"past_service_change\": \"0\"}, \"loss_component\": {\"closing\": \"0\", \"new_business\": \"0\", \"opening\": \"0\", \"service_allocation\": \"0\"}, \"remaining_coverage\": {\"closing\": \"555.00\", \"finance\": \"14.00\", \"loss_allocation\": \"0\", \"new_business_loss\": \"0\", \"opening\": \"0\", \"premiums\": \"1000\", \"service_release\": \"-459.00\"}, \"risk_adjustment\": {\"closing\": \"30\", \"new_business\": \"50\", \"opening\": \"0\", \"service_release\": \"-20\"}}, \"service_expense\": \"420\"}}, \"claim_ids\": [\"claim1\"], \"group_ids\": [\"group1\"], \"policy_ids\": [\"policy1\"], \"requirements\": [\"amounts\", \"financial_risk\", \"insurance_risk\", \"judgments\", \"rollforwards\"]}, \"gl_movements\": {\"Cash\": \"800.00\", \"Insurance finance group1\": \"14.00\", \"Insurance incurred claims group1\": \"-220.00\", \"Insurance remaining coverage group1\": \"-555.00\", \"Insurance service expense group1\": \"420.00\", \"Insurance service revenue group1\": \"-459.00\"}, \"groups\": [{\"acquisition\": \"0\", \"contract_ids\": [\"policy1\"], \"csm\": \"117.00\", \"economic_id\": \"group-economic1\", \"finance\": \"14.00\", \"id\": \"group1\", \"incurred_claims\": \"220\", \"loss_component\": \"0\", \"model\": \"IFRS17_GMM\", \"perspective\": \"issued\", \"portfolio\": \"property\", \"premium\": \"1000\", \"remaining_coverage\": \"555.00\", \"report_id\": \"report1\", \"revenue\": \"459.00\", \"risk_adjustment\": \"30\", \"rollforwards\": {\"csm\": {\"closing\": \"117.00\", \"future_service_change\": \"0\", \"interest\": \"6.00\", \"new_business\": \"150\", \"opening\": \"0\", \"service_release\": \"-39.00\"}, \"incurred_claims\": {\"claim_payments\": \"-200\", \"closing\": \"220\", \"finance\": \"0\", \"incurred_pv\": \"400\", \"incurred_ra\": \"20\", \"opening\": \"0\", \"past_service_change\": \"0\"}, \"loss_component\": {\"closing\": \"0\", \"new_business\": \"0\", \"opening\": \"0\", \"service_allocation\": \"0\"}, \"remaining_coverage\": {\"closing\": \"555.00\", \"finance\": \"14.00\", \"loss_allocation\": \"0\", \"new_business_loss\": \"0\", \"opening\": \"0\", \"premiums\": \"1000\", \"service_release\": \"-459.00\"}, \"risk_adjustment\": {\"closing\": \"30\", \"new_business\": \"50\", \"opening\": \"0\", \"service_release\": \"-20\"}}, \"service_expense\": \"420\"}], \"statement_support\": [{\"account\": \"Cash\", \"category\": \"asset\", \"currency\": \"EUR\", \"economic_id\": \"insurance_cash\", \"group_id\": null, \"id\": \"Cash\", \"signed_balance\": \"800\"}, {\"account\": \"Insurance remaining coverage group1\", \"category\": \"liability\", \"currency\": \"EUR\", \"economic_id\": \"group-economic1\", \"group_id\": \"group1\", \"id\": \"Insurance remaining coverage group1\", \"signed_balance\": \"-555.00\"}, {\"account\": \"Insurance incurred claims group1\", \"category\": \"liability\", \"currency\": \"EUR\", \"economic_id\": \"group-economic1\", \"group_id\": \"group1\", \"id\": \"Insurance incurred claims group1\", \"signed_balance\": \"-220\"}, {\"account\": \"Insurance service revenue group1\", \"category\": \"revenue\", \"currency\": \"EUR\", \"economic_id\": \"group-economic1\", \"group_id\": \"group1\", \"id\": \"Insurance service revenue group1\", \"signed_balance\": \"-459.00\"}, {\"account\": \"Insurance service expense group1\", \"category\": \"expense\", \"currency\": \"EUR\", \"economic_id\": \"group-economic1\", \"group_id\": \"group1\", \"id\": \"Insurance service expense group1\", \"signed_balance\": \"420\"}, {\"account\": \"Insurance finance group1\", \"category\": \"expense\", \"currency\": \"EUR\", \"economic_id\": \"group-economic1\", \"group_id\": \"group1\", \"id\": \"Insurance finance group1\", \"signed_balance\": \"14.00\"}]}\nJournals: [[{\"side\": \"Dr\", \"account\": \"Cash\", \"amount\": \"1000.00\"}, {\"side\": \"Cr\", \"account\": \"Insurance remaining coverage group1\", \"amount\": \"1000.00\"}], [{\"side\": \"Dr\", \"account\": \"Insurance finance group1\", \"amount\": \"14.00\"}, {\"side\": \"Cr\", \"account\": \"Insurance remaining coverage group1\", \"amount\": \"14.00\"}], [{\"side\": \"Dr\", \"account\": \"Insurance remaining coverage group1\", \"amount\": \"459.00\"}, {\"side\": \"Cr\", \"account\": \"Insurance service revenue group1\", \"amount\": \"459.00\"}], [{\"side\": \"Dr\", \"account\": \"Insurance service expense group1\", \"amount\": \"420.00\"}, {\"side\": \"Cr\", \"account\": \"Insurance incurred claims group1\", \"amount\": \"420.00\"}], [{\"side\": \"Dr\", \"account\": \"Insurance incurred claims group1\", \"amount\": \"200.00\"}, {\"side\": \"Cr\", \"account\": \"Cash\", \"amount\": \"200.00\"}]]\nDisclosure review: Insurance amounts and rollforwards; Qualified methods, assumptions and insurance/financial risk; Issued and held populations remain separate; Disclosure Management owns final requirements",
  "jurisdiction": "NL",
  "limitations": [
    "First-year single-currency issued GMM/PAA and native US short-duration routes only; advanced models and specialist owner accounting require separate governed methods.",
    "Current qualified inputs and the operative insurance framework are required; complex models require separate governed methods."
  ],
  "topic_id": "SUPPLEMENTAL_INSURANCE_CONTRACTS",
  "uncertainties": []
}
