{
  "citations": [],
  "effective_period": "2026-01-01 to 2026-12-31",
  "entity_scope": "Synthetic Group",
  "framework": "US_GAAP",
  "guidance": "Accounting case cannot be completed: Missing required facts: owner, reviewer, evidence, approved, approval_date, version, approved_version\nReview status: blocked\nCalculations: {}\nJournals: []\nDisclosure review: Assess pending matter and uncertainty before reporting\nSpecialist handoff: Grant accounting and standards governance owner; required evidence: Approved framework-specific grant knowledge and actual agreements, cost-owner, compliance and policy evidence; Reviewed framework-specific memo, reconciled schedules/journals and disclosure impacts; rerun case with new fingerprint",
  "jurisdiction": "US",
  "limitations": [
    "Missing required facts: owner, reviewer, evidence, approved, approval_date, version, approved_version"
  ],
  "topic_id": "SUPPLEMENTAL_GOVERNMENT_GRANTS",
  "uncertainties": [
    "Missing required facts: owner, reviewer, evidence, approved, approval_date, version, approved_version"
  ]
}
